{
  "schemaVersion": "1.0.0",
  "generatedAt": "2026-08-31T00:06:33.963Z",
  "decision": "inconclusive",
  "counts": {
    "pass": 32,
    "fail": 0,
    "inconclusive": 1
  },
  "environment": {
    "platform": "darwin",
    "release": "25.4.0",
    "architecture": "arm64",
    "node": "v22.23.2",
    "execution": "local headless gates with separately recorded real-browser laptop GPU evidence; no deployment; representative mobile unmeasured"
  },
  "gates": [
    {
      "id": "data.checked-in-artifacts",
      "status": "pass",
      "detail": "All measured assertions passed.",
      "evidence": {
        "sha256": {
          "data/corpus/deep-metro-reviewed-beta.json": "47feb6b98826746edd35a00acdc5d6fd12e6d0daa304097bef65e57acd75558c",
          "data/odbl/north-america-facilities.json": "e754ec1587e10144ced1b95c8ed19d7a3f4565fc65fc299592ce458b78888ed9",
          "data/reports/north-america-coverage.json": "a01ca788745572bbc77c2945cdb089a45e7830de0ee9a34e5b2c50f5ed57cff3"
        }
      }
    },
    {
      "id": "data.deep-metro",
      "status": "pass",
      "detail": "All measured assertions passed.",
      "evidence": {
        "timelines": 100,
        "timelinesByMetro": {
          "northern-virginia": 25,
          "dallas-fort-worth": 25,
          "phoenix": 25,
          "toronto": 25
        },
        "events": 288,
        "citations": 308,
        "activations": 20,
        "corrections": 8,
        "conflicts": 12
      }
    },
    {
      "id": "data.inventory-coverage",
      "status": "pass",
      "detail": "All measured assertions passed.",
      "evidence": {
        "records": 6,
        "conflicts": 1,
        "synthetic": true,
        "notComplete": true
      }
    },
    {
      "id": "license.source-manifests",
      "status": "pass",
      "detail": "All measured assertions passed.",
      "evidence": {
        "manifests": 13,
        "producedSourceIds": [
          "osm-overpass-v1"
        ]
      }
    },
    {
      "id": "license.packages",
      "status": "pass",
      "detail": "Every installed Node package is allowed or has an explicit approved disposition and current notice.",
      "evidence": {
        "packages": [
          {
            "name": "@axe-core/playwright",
            "version": "4.13.0",
            "license": "MPL-2.0"
          },
          {
            "name": "@babel/code-frame",
            "version": "7.29.7",
            "license": "MIT"
          },
          {
            "name": "@babel/compat-data",
            "version": "7.29.7",
            "license": "MIT"
          },
          {
            "name": "@babel/core",
            "version": "7.29.7",
            "license": "MIT"
          },
          {
            "name": "@babel/generator",
            "version": "7.29.8",
            "license": "MIT"
          },
          {
            "name": "@babel/helper-compilation-targets",
            "version": "7.29.7",
            "license": "MIT"
          },
          {
            "name": "@babel/helper-globals",
            "version": "7.29.7",
            "license": "MIT"
          },
          {
            "name": "@babel/helper-module-imports",
            "version": "7.29.7",
            "license": "MIT"
          },
          {
            "name": "@babel/helper-module-transforms",
            "version": "7.29.7",
            "license": "MIT"
          },
          {
            "name": "@babel/helper-string-parser",
            "version": "7.29.7",
            "license": "MIT"
          },
          {
            "name": "@babel/helper-validator-identifier",
            "version": "7.29.7",
            "license": "MIT"
          },
          {
            "name": "@babel/helper-validator-option",
            "version": "7.29.7",
            "license": "MIT"
          },
          {
            "name": "@babel/helpers",
            "version": "7.29.7",
            "license": "MIT"
          },
          {
            "name": "@babel/parser",
            "version": "7.29.8",
            "license": "MIT"
          },
          {
            "name": "@babel/template",
            "version": "7.29.7",
            "license": "MIT"
          },
          {
            "name": "@babel/traverse",
            "version": "7.29.8",
            "license": "MIT"
          },
          {
            "name": "@babel/types",
            "version": "7.29.8",
            "license": "MIT"
          },
          {
            "name": "@deck.gl/core",
            "version": "9.3.11",
            "license": "MIT"
          },
          {
            "name": "@deck.gl/layers",
            "version": "9.3.11",
            "license": "MIT"
          },
          {
            "name": "@deck.gl/mapbox",
            "version": "9.3.11",
            "license": "MIT"
          },
          {
            "name": "@eslint-community/eslint-utils",
            "version": "4.9.1",
            "license": "MIT"
          },
          {
            "name": "@eslint-community/eslint-utils",
            "version": "4.10.1",
            "license": "MIT"
          },
          {
            "name": "@eslint-community/regexpp",
            "version": "4.12.2",
            "license": "MIT"
          },
          {
            "name": "@eslint/config-array",
            "version": "0.21.2",
            "license": "Apache-2.0"
          },
          {
            "name": "@eslint/config-array",
            "version": "0.23.5",
            "license": "Apache-2.0"
          },
          {
            "name": "@eslint/config-helpers",
            "version": "0.4.2",
            "license": "Apache-2.0"
          },
          {
            "name": "@eslint/config-helpers",
            "version": "0.7.0",
            "license": "Apache-2.0"
          },
          {
            "name": "@eslint/core",
            "version": "0.17.0",
            "license": "Apache-2.0"
          },
          {
            "name": "@eslint/core",
            "version": "1.2.1",
            "license": "Apache-2.0"
          },
          {
            "name": "@eslint/eslintrc",
            "version": "3.3.6",
            "license": "MIT"
          },
          {
            "name": "@eslint/js",
            "version": "9.39.5",
            "license": "MIT"
          },
          {
            "name": "@eslint/js",
            "version": "10.0.1",
            "license": "MIT"
          },
          {
            "name": "@eslint/object-schema",
            "version": "2.1.7",
            "license": "Apache-2.0"
          },
          {
            "name": "@eslint/object-schema",
            "version": "3.0.5",
            "license": "Apache-2.0"
          },
          {
            "name": "@eslint/plugin-kit",
            "version": "0.4.1",
            "license": "Apache-2.0"
          },
          {
            "name": "@eslint/plugin-kit",
            "version": "0.7.2",
            "license": "Apache-2.0"
          },
          {
            "name": "@humanfs/core",
            "version": "0.19.2",
            "license": "Apache-2.0"
          },
          {
            "name": "@humanfs/node",
            "version": "0.16.8",
            "license": "Apache-2.0"
          },
          {
            "name": "@humanfs/types",
            "version": "0.15.0",
            "license": "Apache-2.0"
          },
          {
            "name": "@humanwhocodes/module-importer",
            "version": "1.0.1",
            "license": "Apache-2.0"
          },
          {
            "name": "@humanwhocodes/retry",
            "version": "0.4.3",
            "license": "Apache-2.0"
          },
          {
            "name": "@img/colour",
            "version": "1.1.0",
            "license": "MIT"
          },
          {
            "name": "@img/sharp-darwin-arm64",
            "version": "0.35.4",
            "license": "Apache-2.0"
          },
          {
            "name": "@img/sharp-libvips-darwin-arm64",
            "version": "1.3.3",
            "license": "LGPL-3.0-or-later"
          },
          {
            "name": "@jridgewell/gen-mapping",
            "version": "0.3.13",
            "license": "MIT"
          },
          {
            "name": "@jridgewell/remapping",
            "version": "2.3.5",
            "license": "MIT"
          },
          {
            "name": "@jridgewell/resolve-uri",
            "version": "3.1.2",
            "license": "MIT"
          },
          {
            "name": "@jridgewell/sourcemap-codec",
            "version": "1.6.0",
            "license": "MIT"
          },
          {
            "name": "@jridgewell/trace-mapping",
            "version": "0.3.31",
            "license": "MIT"
          },
          {
            "name": "@loaders.gl/core",
            "version": "4.4.5",
            "license": "MIT"
          },
          {
            "name": "@loaders.gl/images",
            "version": "4.4.5",
            "license": "MIT"
          },
          {
            "name": "@loaders.gl/loader-utils",
            "version": "4.4.5",
            "license": "MIT"
          },
          {
            "name": "@loaders.gl/schema",
            "version": "4.4.5",
            "license": "MIT"
          },
          {
            "name": "@loaders.gl/schema-utils",
            "version": "4.4.5",
            "license": "MIT"
          },
          {
            "name": "@loaders.gl/worker-utils",
            "version": "4.4.5",
            "license": "MIT"
          },
          {
            "name": "@luma.gl/core",
            "version": "9.3.6",
            "license": "MIT"
          },
          {
            "name": "@luma.gl/engine",
            "version": "9.3.6",
            "license": "MIT"
          },
          {
            "name": "@luma.gl/shadertools",
            "version": "9.3.6",
            "license": "MIT"
          },
          {
            "name": "@luma.gl/webgl",
            "version": "9.3.6",